[
  {
    "name": "2025.04.16 ~ 2025.12.31",
    "date": {
      "begin": {
        "year": 2025,
        "month": 4,
        "day": 16
      },
      "end": {
        "year": 2025,
        "month": 12,
        "day": 31
      }
    },
    "resolution": {
      "width": 1080,
      "height": 2588
    },
    "function": "ocr_2025_04_16_2025_12_31",
    "description": "最新",
    "enabled": true
  },
  {
    "name": "2025.04.13 ~ 2025.04.15",
    "date": {
      "begin": {
        "year": 2025,
        "month": 4,
        "day": 13
      },
      "end": {
        "year": 2025,
        "month": 4,
        "day": 15
      }
    },
    "resolution": {
      "width": 1080,
      "height": 2665
    },
    "function": "ocr_2025_04_13_2025_04_15",
    "description": "",
    "enabled": true
  },
  {
    "name": "2025.04.12",
    "date": {
      "begin": {
        "year": 2025,
        "month": 4,
        "day": 12
      },
      "end": {
        "year": 2025,
        "month": 4,
        "day": 12
      }
    },
    "resolution": {
      "width": 1080,
      "height": 2512
    },
    "function": "ocr_2025_04_12",
    "description": "大风",
    "enabled": true
  },
  {
    "name": "2024.12.15 ~ 2025.04.11",
    "date": {
      "begin": {
        "year": 2024,
        "month": 12,
        "day": 15
      },
      "end": {
        "year": 2025,
        "month": 4,
        "day": 11
      }
    },
    "resolution": {
      "width": 1080,
      "height": 2665
    },
    "function": "ocr_2024_12_15_2025_04_11",
    "description": "",
    "enabled": true
  },
  {
    "name": "2024.09.01 ~ 2024.12.14",
    "date": {
      "begin": {
        "year": 2024,
        "month": 9,
        "day": 1
      },
      "end": {
        "year": 2024,
        "month": 12,
        "day": 14
      }
    },
    "resolution": {
      "width": 1080,
      "height": 2665
    },
    "function": "ocr_2024_09_01_2024_12_14",
    "description": "",
    "enabled": true
  },
  {
    "name": "2024.08.31",
    "date": {
      "begin": {
        "year": 2024,
        "month": 8,
        "day": 31
      },
      "end": {
        "year": 2024,
        "month": 8,
        "day": 31
      }
    },
    "resolution": {
      "width": 1080,
      "height": 2720
    },
    "function": "ocr_2024_08_31",
    "description": "",
    "enabled": true
  },
  {
    "name": "2024.08.04 ~ 2024.08.30",
    "date": {
      "begin": {
        "year": 2024,
        "month": 8,
        "day": 4
      },
      "end": {
        "year": 2024,
        "month": 8,
        "day": 30
      }
    },
    "resolution": {
      "width": 1080,
      "height": 2720
    },
    "function": "ocr_2024_08_04_2024_08_30",
    "description": "",
    "enabled": true
  },
  {
    "name": "2024.08.03",
    "date": {
      "begin": {
        "year": 2024,
        "month": 8,
        "day": 3
      },
      "end": {
        "year": 2024,
        "month": 8,
        "day": 3
      }
    },
    "resolution": {
      "width": 1080,
      "height": 2720
    },
    "function": "ocr_2024_08_03",
    "description": "",
    "enabled": true
  },
  {
    "name": "2024.07.13 ~ 2024.08.02",
    "date": {
      "begin": {
        "year": 2024,
        "month": 7,
        "day": 13
      },
      "end": {
        "year": 2024,
        "month": 8,
        "day": 2
      }
    },
    "resolution": {
      "width": 1080,
      "height": 2720
    },
    "function": "ocr_2024_07_13_2024_08_02",
    "description": "",
    "enabled": true
  },
  {
    "name": "2024.07.10 ~ 2024.07.12",
    "date": {
      "begin": {
        "year": 2024,
        "month": 7,
        "day": 10
      },
      "end": {
        "year": 2024,
        "month": 7,
        "day": 12
      }
    },
    "resolution": {
      "width": 1080,
      "height": 2720
    },
    "function": "ocr_2024_07_10_2024_07_12",
    "description": "",
    "enabled": true
  },
  {
    "name": "2024.05.30 ~ 2024.07.09",
    "date": {
      "begin": {
        "year": 2024,
        "month": 5,
        "day": 30
      },
      "end": {
        "year": 2024,
        "month": 7,
        "day": 9
      }
    },
    "resolution": {
      "width": 1080,
      "height": 2720
    },
    "function": "ocr_2024_05_30_2024_07_09",
    "description": "",
    "enabled": true
  },
  {
    "name": "2024.05.29",
    "date": {
      "begin": {
        "year": 2024,
        "month": 5,
        "day": 29
      },
      "end": {
        "year": 2024,
        "month": 5,
        "day": 29
      }
    },
    "resolution": {
      "width": 1080,
      "height": 2720
    },
    "function": "ocr_2024_05_29",
    "description": "",
    "enabled": true
  },
  {
    "name": "2024.04.02 ~ 2024.05.28",
    "date": {
      "begin": {
        "year": 2024,
        "month": 4,
        "day": 2
      },
      "end": {
        "year": 2024,
        "month": 5,
        "day": 28
      }
    },
    "resolution": {
      "width": 1080,
      "height": 2720
    },
    "function": "ocr_2024_04_02_2024_05_28",
    "description": "",
    "enabled": true
  },
  {
    "name": "2024.03.31 ~ 2024.04.01",
    "date": {
      "begin": {
        "year": 2024,
        "month": 3,
        "day": 31
      },
      "end": {
        "year": 2024,
        "month": 4,
        "day": 1
      }
    },
    "resolution": {
      "width": 1080,
      "height": 2078
    },
    "function": "ocr_2024_03_31_2024_04_01",
    "description": "",
    "enabled": true
  },
  {
    "name": "2024.03.29 ~ 2024.03.30",
    "date": {
      "begin": {
        "year": 2024,
        "month": 3,
        "day": 29
      },
      "end": {
        "year": 2024,
        "month": 3,
        "day": 30
      }
    },
    "resolution": {
      "width": 720,
      "height": 1387
    },
    "function": "ocr_2024_03_29_2024_03_30",
    "description": "",
    "enabled": true
  },
  {
    "name": "2024.03.25 ~ 2024.03.28",
    "date": {
      "begin": {
        "year": 2024,
        "month": 3,
        "day": 25
      },
      "end": {
        "year": 2024,
        "month": 3,
        "day": 28
      }
    },
    "resolution": {
      "width": 1080,
      "height": 2078
    },
    "function": "ocr_2024_03_25_2024_03_28",
    "description": "",
    "enabled": true
  },
  {
    "name": "2024.03.22 ~ 2024.03.24",
    "date": {
      "begin": {
        "year": 2024,
        "month": 3,
        "day": 22
      },
      "end": {
        "year": 2024,
        "month": 3,
        "day": 24
      }
    },
    "resolution": {
      "width": 720,
      "height": 1387
    },
    "function": "ocr_2024_03_22_2024_03_24",
    "description": "",
    "enabled": true
  },
  {
    "name": "2024.03.17 ~ 2024.03.21",
    "date": {
      "begin": {
        "year": 2024,
        "month": 3,
        "day": 17
      },
      "end": {
        "year": 2024,
        "month": 3,
        "day": 21
      }
    },
    "resolution": {
      "width": 1080,
      "height": 2078
    },
    "function": "ocr_2024_03_17_2024_03_21",
    "description": "",
    "enabled": true
  },
  {
    "name": "2024.03.15 ~ 2024.03.16",
    "date": {
      "begin": {
        "year": 2024,
        "month": 3,
        "day": 15
      },
      "end": {
        "year": 2024,
        "month": 3,
        "day": 16
      }
    },
    "resolution": {
      "width": 720,
      "height": 1387
    },
    "function": "ocr_2024_03_15_2024_03_16",
    "description": "",
    "enabled": true
  },
  {
    "name": "2024.03.12 ~ 2024.03.14",
    "date": {
      "begin": {
        "year": 2024,
        "month": 3,
        "day": 12
      },
      "end": {
        "year": 2024,
        "month": 3,
        "day": 14
      }
    },
    "resolution": {
      "width": 1080,
      "height": 2078
    },
    "function": "ocr_2024_03_12_2024_03_14",
    "description": "",
    "enabled": true
  },
  {
    "name": "2024.03.11",
    "date": {
      "begin": {
        "year": 2024,
        "month": 3,
        "day": 11
      },
      "end": {
        "year": 2024,
        "month": 3,
        "day": 11
      }
    },
    "resolution": {
      "width": 720,
      "height": 1387
    },
    "function": "ocr_2024_03_11",
    "description": "",
    "enabled": true
  },
  {
    "name": "2024.03.10",
    "date": {
      "begin": {
        "year": 2024,
        "month": 3,
        "day": 10
      },
      "end": {
        "year": 2024,
        "month": 3,
        "day": 10
      }
    },
    "resolution": {
      "width": 1080,
      "height": 2078
    },
    "function": "ocr_2024_03_10",
    "description": "",
    "enabled": true
  },
  {
    "name": "2024.03.08 ~ 2024.03.09",
    "date": {
      "begin": {
        "year": 2024,
        "month": 3,
        "day": 8
      },
      "end": {
        "year": 2024,
        "month": 3,
        "day": 9
      }
    },
    "resolution": {
      "width": 720,
      "height": 1387
    },
    "function": "ocr_2024_03_08_2024_03_09",
    "description": "",
    "enabled": true
  },
  {
    "name": "2024.03.03 ~ 2024.03.07",
    "date": {
      "begin": {
        "year": 2024,
        "month": 3,
        "day": 3
      },
      "end": {
        "year": 2024,
        "month": 3,
        "day": 7
      }
    },
    "resolution": {
      "width": 1080,
      "height": 2078
    },
    "function": "ocr_2024_03_03_2024_03_07",
    "description": "",
    "enabled": true
  },
  {
    "name": "2024.03.01 ~ 2024.03.02",
    "date": {
      "begin": {
        "year": 2024,
        "month": 3,
        "day": 1